{
  "attempts": [
    {
      "attempt_number": 1,
      "http_status": 200,
      "operation": "github_current_pr_metadata",
      "retrieved_at": "2026-10-02T14:34:53.576420+00:00",
      "retry": false,
      "status": "success"
    }
  ],
  "authoritative_R_i_tFG": "",
  "candidate_repository_boundaries": [
    "efe8fa4f424f357399e7fdaebc5c666de987e597",
    "ebd30f10a856a398151b3b8009c0f833b64e4506"
  ],
  "case_id": "CASE_F13F98792012",
  "conflicts": [],
  "derivation_chain": [],
  "development_linkage_status": "unresolved",
  "evidence_claims": [
    {
      "adequate_provenance": true,
      "candidate_sha": "efe8fa4f424f357399e7fdaebc5c666de987e597",
      "claim_id": "CASE_F13F98792012-B4-2-efe8fa4f424f",
      "cross_validated": false,
      "derivation_inputs": [
        "20231012_233628_pr_sharings.json",
        "efe8fa4f424f357399e7fdaebc5c666de987e597"
      ],
      "derivation_rule": "archived_pr_commit_membership_lead",
      "development_context_linkage": "established",
      "evidence_hash": "c54e282b50186020924b87c555c5ccae370173920855cc7279a17c8bfb4d5e7b",
      "evidence_level": "B4",
      "historical_source_timestamp": "2023-10-12T23:36:28+00:00",
      "immutable_git_relationships": [],
      "provenance_reference": "cases/reconstruction/CASE_F13F98792012/evidence/archive_derivation_leads_v2.json",
      "relation_to_tFG": "after",
      "source_identifier": "20231012_233628_pr_sharings.json",
      "timestamp_precision": "timestamp",
      "uses_outcome_information": false,
      "validation_status": "unresolved"
    },
    {
      "adequate_provenance": true,
      "candidate_sha": "ebd30f10a856a398151b3b8009c0f833b64e4506",
      "claim_id": "CASE_F13F98792012-B5-2-ebd30f10a856",
      "cross_validated": false,
      "derivation_inputs": [
        "cases/reconstruction/CASE_F13F98792012/evidence/current_pr_metadata_sanitized_v2.json",
        "ebd30f10a856a398151b3b8009c0f833b64e4506"
      ],
      "derivation_rule": "current_pr_base_supporting_only",
      "development_context_linkage": "unresolved",
      "evidence_hash": "31cda08132922a22a79f9cc0236194805e1666eb752e1e4209e5581ced3a265e",
      "evidence_level": "B5",
      "historical_source_timestamp": "2026-10-02T14:34:53.576420+00:00",
      "immutable_git_relationships": [],
      "provenance_reference": "https://api.github.com/repos/agentcoinorg/evo.ninja/pulls/206",
      "relation_to_tFG": "after",
      "source_identifier": "https://api.github.com/repos/agentcoinorg/evo.ninja/pulls/206",
      "timestamp_precision": "timestamp",
      "uses_outcome_information": false,
      "validation_status": "supporting_only"
    }
  ],
  "executed": true,
  "historical_state_reconstructible": "unresolved",
  "human_adjudication_status": "not_required",
  "materialization_status": "not_attempted",
  "methodology_version": "dir-tfg-v2",
  "object_validation_status": "not_attempted",
  "operational_reason": "",
  "pr": {
    "component_status": "available_by_tFG",
    "created_at": "2023-09-25T11:08:34Z",
    "existed_by_tFG": "yes",
    "number": 206
  },
  "primary_repository_cutoff": "tFG",
  "procedure_version": "post-stage-c-development-baseline-pilot-v2",
  "reconstruction_contract_version": "post-stage-c-reconstruction-v2",
  "record_version": "historical-state-acquisition-v2",
  "repository": "polywrap/evo.ninja",
  "scientific_reason": "no_qualifying_development_baseline_claim",
  "tC": {
    "precision": "timestamp",
    "source": "first developer turn in parsed conversation",
    "status": "derivable",
    "value": "2023-09-25T11:59:01.557490+00:00"
  },
  "tFG": {
    "precision": "timestamp",
    "source": "turn_000003.create_time",
    "status": "derivable",
    "value": "2023-09-25T11:59:29.032600+00:00"
  },
  "target_identity_status": "unresolved",
  "target_rule": "historically_justified_development_repository_baseline_at_tFG",
  "temporal_applicability_status": "unresolved",
  "tree_identity": "",
  "tree_validation_status": "not_attempted"
}
