{
  "attempts": [
    {
      "attempt_number": 1,
      "http_status": 200,
      "operation": "github_current_pr_metadata",
      "retrieved_at": "2026-10-02T14:34:50.829179+00:00",
      "retry": false,
      "status": "success"
    }
  ],
  "authoritative_R_i_tFG": "",
  "candidate_repository_boundaries": [
    "3a56f30491f7a44e4c49d094e44b1c18ded8cdad"
  ],
  "case_id": "CASE_BFB2599E145D",
  "conflicts": [],
  "derivation_chain": [],
  "development_linkage_status": "unresolved",
  "evidence_claims": [
    {
      "adequate_provenance": true,
      "candidate_sha": "3a56f30491f7a44e4c49d094e44b1c18ded8cdad",
      "claim_id": "CASE_BFB2599E145D-B5-2-3a56f30491f7",
      "cross_validated": false,
      "derivation_inputs": [
        "cases/reconstruction/CASE_BFB2599E145D/evidence/current_pr_metadata_sanitized_v2.json",
        "3a56f30491f7a44e4c49d094e44b1c18ded8cdad"
      ],
      "derivation_rule": "current_pr_base_supporting_only",
      "development_context_linkage": "unresolved",
      "evidence_hash": "e146e763403318611fc1653609c96a026bf6d7935e999db6e2a0ceaa2b39f9f4",
      "evidence_level": "B5",
      "historical_source_timestamp": "2026-10-02T14:34:50.829179+00:00",
      "immutable_git_relationships": [],
      "provenance_reference": "https://api.github.com/repos/hufscheer/web-v1/pulls/119",
      "relation_to_tFG": "after",
      "source_identifier": "https://api.github.com/repos/hufscheer/web-v1/pulls/119",
      "timestamp_precision": "timestamp",
      "uses_outcome_information": false,
      "validation_status": "supporting_only"
    }
  ],
  "executed": true,
  "historical_state_reconstructible": "unresolved",
  "human_adjudication_status": "not_required",
  "materialization_status": "not_attempted",
  "methodology_version": "dir-tfg-v2",
  "object_validation_status": "not_attempted",
  "operational_reason": "",
  "pr": {
    "component_status": "unavailable_by_tFG",
    "created_at": "2023-11-30T09:19:13Z",
    "existed_by_tFG": "no",
    "number": 119
  },
  "primary_repository_cutoff": "tFG",
  "procedure_version": "post-stage-c-development-baseline-pilot-v2",
  "reconstruction_contract_version": "post-stage-c-reconstruction-v2",
  "record_version": "historical-state-acquisition-v2",
  "repository": "hufscheer/client",
  "scientific_reason": "no_qualifying_development_baseline_claim",
  "tC": {
    "precision": "timestamp",
    "source": "first developer turn in parsed conversation",
    "status": "derivable",
    "value": "2023-11-30T08:40:08.698626+00:00"
  },
  "tFG": {
    "precision": "timestamp",
    "source": "turn_000003.create_time",
    "status": "derivable",
    "value": "2023-11-30T08:40:22.179209+00:00"
  },
  "target_identity_status": "unresolved",
  "target_rule": "historically_justified_development_repository_baseline_at_tFG",
  "temporal_applicability_status": "unresolved",
  "tree_identity": "",
  "tree_validation_status": "not_attempted"
}
